### ISSUE TITLE
Robot vacuum DA_VR_VR90F_QRB4210_25K — host up, config flow no_response (no DTLS on 49152–49160)

### ISSUE THREAD

**Issue by MinYn** [mbillow/localthings#424]
### Appliance model

- SmartThings model: `DA_VR_VR90F_QRB4210_25K`
- SmartThings type: Samsung OCF Robot Vacuum (`RobotCleaner`)
- Consumer name: Samsung Jet Bot / Bespoke robot vacuum (KR)

The unit is online on the LAN (ICMP replies). Official Home Assistant SmartThings integration controls it.

### What's missing or wrong

LocalThings v0.24.0, Home Assistant OS 2026.8.3. Config flow reuses CA credentials that already work for cooktop / fridges / water purifier on the same LAN. Result:

```
no_response
```

(about 12s — faster than the full 9-port handshake timeout, consistent with ICMP-refused ports rather than a silent filtered range)

UDP `49152–49160` from the LAN: `49154` returns `ECONNREFUSED`; neighboring ports in the range are refused or silent. TCP `8888` is closed. No DTLS `HelloVerifyRequest` / ServerHello. Cannot create a config entry, so no LocalThings diagnostics download.

This is a **robot vacuum**, not a stick-vacuum clean station. Related: #122 (`VR7MD96514G/EU`) — handshake never completed; #13-style plain CoAP also timed out there and the issue was closed as no local CoAP/DTLS to hook into. This report is a second robot-vac datapoint with an even cleaner "no listener on the DTLS range" shape.

Same household LocalThings successes (same CA):

- `TP1X_DA-KS-COOKTOP-01011`
- `TP1X_REF_21K` (fridge + kimchi fridge)
- `TP2X_WATERPURIFIER_20K`

Happy to run `tcpdump` during a config-flow retry or any probe from `smartthings-local` if that would help. I cannot attach a LocalThings diagnostics JSON because setup never succeeds.

### Diagnostics file

N/A — device never becomes a LocalThings config entry. Model string is from the Home Assistant SmartThings integration (identifiers/IPs/MACs omitted).

**Comment by MinYn** [comment]
## Follow-up: tcpdump + config flow

Could a maintainer please add label `device:vacuum`? (I don't have triage permission on this repo.)

LocalThings config flow against this vacuum just now: **`no_dtls_server`** in 11.6s (v0.24.0, same CA that works for cooktop/fridges/purifier).

I captured a probe from another LAN host (not HA itself — switched L2 so I cannot sniff HA's unicast). Filter: `host <vacuum> and (udp portrange 49152-49160 or tcp port 8888 or icmp)`. IPs/MACs rewritten: prober `192.168.0.2`, vacuum `192.168.0.10`.

### Result

There is **no DTLS server**. Every probe is ICMP port-unreachable or silent; TCP 8888 is RST. OpenSSL DTLS 1.2 to 49154: `write:errno=111`, 0 bytes read.

| Port | Response |
|---|---|
| UDP 49152–49154, 49156–49158, 49160 | ICMP **port unreachable** |
| UDP 49155, 49159 | often silent (timeout), sometimes later ICMP unreach |
| TCP 8888 | **RST** (closed) |
| DTLS ClientHello (111 or 214 bytes) | never answered with DTLS; ICMP unreach only |

Redacted text dump: https://gist.github.com/MinYn/4c041c36c1c849a215e5dfe22dbccd06

```
2026-08-31 07:12:16.125732 IP 192.168.0.2.49355 > 192.168.0.10.49152: UDP, length 1
2026-08-31 07:12:16.128301 IP 192.168.0.10 > 192.168.0.2: ICMP 192.168.0.10 udp port 49152 unreachable, length 37
2026-08-31 07:12:16.128443 IP 192.168.0.2.49355 > 192.168.0.10.49152: UDP, length 111
2026-08-31 07:12:16.130665 IP 192.168.0.10 > 192.168.0.2: ICMP 192.168.0.10 udp port 49152 unreachable, length 147
2026-08-31 07:12:16.130800 IP 192.168.0.2.57692 > 192.168.0.10.49153: UDP, length 1
2026-08-31 07:12:16.135933 IP 192.168.0.10 > 192.168.0.2: ICMP 192.168.0.10 udp port 49153 unreachable, length 37
2026-08-31 07:12:16.135994 IP 192.168.0.2.57692 > 192.168.0.10.49153: UDP, length 111
2026-08-31 07:12:16.138081 IP 192.168.0.10 > 192.168.0.2: ICMP 192.168.0.10 udp port 49153 unreachable, length 147
2026-08-31 07:12:16.138165 IP 192.168.0.2.36111 > 192.168.0.10.49154: UDP, length 1
2026-08-31 07:12:16.139499 IP 192.168.0.10 > 192.168.0.2: ICMP 192.168.0.10 udp port 49154 unreachable, length 37
2026-08-31 07:12:16.139537 IP 192.168.0.2.36111 > 192.168.0.10.49154: UDP, length 111
2026-08-31 07:12:16.144098 IP 192.168.0.10 > 192.168.0.2: ICMP 192.168.0.10 udp port 49154 unreachable, length 147
2026-08-31 07:12:16.144314 IP 192.168.0.2.52805 > 192.168.0.10.49155: UDP, length 1
2026-08-31 07:12:16.745367 IP 192.168.0.2.52805 > 192.168.0.10.49155: UDP, length 111
2026-08-31 07:12:17.346166 IP 192.168.0.2.34523 > 192.168.0.10.49156: UDP, length 1
2026-08-31 07:12:17.354385 IP 192.168.0.10 > 192.168.0.2: ICMP 192.168.0.10 udp port 49156 unreachable, length 37
2026-08-31 07:12:17.354522 IP 192.168.0.2.34523 > 192.168.0.10.49156: UDP, length 111
2026-08-31 07:12:17.955316 IP 192.168.0.2.37399 > 192.168.0.10.49157: UDP, length 1
2026-08-31 07:12:18.556071 IP 192.168.0.2.37399 > 192.168.0.10.49157: UDP, length 111
2026-08-31 07:12:18.561459 IP 192.168.0.10 > 192.168.0.2: ICMP 192.168.0.10 udp port 49157 unreachable, length 147
2026-08-31 07:12:18.561656 IP 192.168.0.2.59322 > 192.168.0.10.49158: UDP, length 1
2026-08-31 07:12:19.162417 IP 192.168.0.2.59322 > 192.168.0.10.49158: UDP, length 111
2026-08-31 07:12:19.167919 IP 192.168.0.10 > 192.168.0.2: ICMP 192.168.0.10 udp port 49158 unreachable, length 147
2026-08-31 07:12:19.168183 IP 192.168.0.2.48545 > 192.168.0.10.49159: UDP, length 1
2026-08-31 07:12:19.768312 IP 192.168.0.2.48545 > 192.168.0.10.49159: UDP, length 111
2026-08-31 07:12:20.368734 IP 192.168.0.2.48475 > 192.168.0.10.49160: UDP, length 1
2026-08-31 07:12:20.370393 IP 192.168.0.10 > 192.168.0.2: ICMP 192.168.0.10 udp port 49160 unreachable, length 37
2026-08-31 07:12:20.370473 IP 192.168.0.2.48475 > 192.168.0.10.49160: UDP, length 111
2026-08-31 07:12:20.971180 IP 192.168.0.2.52790 > 192.168.0.10.8888: Flags [S], seq 2131737721, win 64240, options [mss 1460,sackOK,TS val 1073372151 ecr 0,nop,wscale 10], length 0
2026-08-31 07:12:20.972874 IP 192.168.0.10.8888 > 192.168.0.2.52790: Flags [R.], seq 0, ack 2131737722, win 0, length 0
2026-08-31 07:12:20.995514 IP 192.168.0.2.40437 > 192.168.0.10.49154: UDP, length 214
2026-08-31 07:12:22.038319 IP 192.168.0.2.40437 > 192.168.0.10.49154: UDP, length 214
2026-08-31 07:12:22.040692 IP 192.168.0.10 > 192.168.0.2: ICMP 192.168.0.10 udp port 49154 unreachable, length 250
```

Happy to capture on the HA host itself if you want the config-flow packets specifically — they should look the same given ICMP unreach on the whole range.

**Comment by mbillow** [comment]
Can you do me a favor and checkout the research in https://github.com/QuiteYellow/SmartThings-Local/issues/16? Does your device respond to any of those patterns?

**Comment by MinYn** [comment]
Follow-up from the same household (no IPs/MACs/UUIDs/serials).

The earlier `no_response` on UDP 49152–49160 was a **port-range miss**, not “no local OCF”.

### What is actually on the LAN
- ICMP-reachable robot (`oic.d.robotcleaner`).
- **No TCP listener** on 1–1024 or 8888.
- **No DTLS** on 49152–49160.
- **Plaintext OCF on UDP 5683** (`GET /oic/d`, `/oic/res`, `/oic/sec/doxm`, `/oic/sec/pstat` all 2.05).
- **DTLS on standard UDP 5684** (HelloVerifyRequest). `/oic/res` also advertises a **dynamic `coaps` port** that moves (one observation: a 4xxxx port also answered ClientHello).

LocalThings’ config-flow probe of 49152–49160 alone will never see this unit. The library’s `discover_ocf_secure_ports()` + `probe_dtls_ports()` path does.

### Public security state (redacted)
- `/oic/sec/doxm`: `oxms = [2, 65282]` (standard mfg-cert OTM `2` and Samsung `0xFF02`); `oxmsel = 2`; `sct = 1`.
- `/oic/sec/pstat`: `isop = true`, `cm = 0`, `om = 4`, `sm = 4` — already operational / owned. We did **not** run OTM or touch `/oic/sec/*` writes.

### Auth profile
Stateful diagnostic handshake to 5684 with the working **AC14K_M** client chain (same cert that this LAN’s cooktop/fridges/water purifier accept on 4915x):

- Server flights: HelloVerifyRequest, ServerHello, Certificate, ServerKeyExchange, CertificateRequest, ServerHelloDone.
- Server cert role: `OU=OCF HA Device` (Samsung OCF HA Device SubCA v1, ECDSA).
- Fatal alert: **`unknown_ca`**.

That matches the newer OCF-PKI laundry profile in [QuiteYellow/SmartThings-Local `docs/ocf-pki-laundry.md`](https://github.com/QuiteYellow/SmartThings-Local/blob/main/docs/ocf-pki-laundry.md) / issues #16/#20: local OCF is present; the public AC14K_M identity is not in the device’s trust store.

A diagnostic handshake **without** a client cert reached `completed` with a trailing HelloRequest (server is waiting for a client cert from the OCF HA Device hierarchy). Protected `/.../vs/0` hrefs on plaintext 5683 return **4.03**.

### Public resource directory
`GET /oic/res` is ~24 KiB, **187 hrefs**. This is a full robot-cleaner tree, not a stick-vacuum station. Sanitized samples (no values):

- control: `/power/vs/0`, `/mode/vs/0`, `/device/0`, `/homing/vs/0`, `/findrobotcleaner/vs/0`, `/direction/vs/0`
- map/clean: `/map/vs/0`, `/map/areaclean/vs/0`, `/map/spotclean/vs/0`, `/map/cleaninfo/vs/0`, …
- station: `/station/vs/0`, `/component/station/dustbag/vs/0`, `/component/station/filter/hepafilter/vs/0`, `/mop/settings/vs/0`
- energy: `/energy/consumption/vs/0`, `/energy/battery/vs/0`, `/battery/vs/0`
- media/cam: `/video/stream/vs/0`, `/media/playback/vs/0`, `/hass/state/vs/0`, `/hass/command/vs/0`

### What this means for LocalThings
1. Detection should include **5684** (and advertised `coaps` ports from `/oic/res`), not only 49152–49160 — otherwise this robot looks like `no_dtls_server`.
2. Even after detection, **runtime control still needs an authorized OCF-PKI client credential**. AC14K_M is rejected. We are not going to attempt ownership-reset / OTM on an already-owned unit.
3. Capability mapping can be drafted from the public href list, but it is blocked on (2).

**Comment by MinYn** [comment]
@mbillow yes — I went through [QuiteYellow/SmartThings-Local#16](https://github.com/QuiteYellow/SmartThings-Local/issues/16) (and the laundry mapping in `docs/ocf-pki-laundry.md`) against this robot. Short version: **same OCF-PKI *shape* as #16**, not the 4915x/AC14K_M fleet. The earlier 49152–49160 ICMP-unreach capture was real; it just wasn’t the OCF surface.

No IPs / MACs / UUIDs / serials / cert fingerprints below.

| #16 pattern (WD53) | This robot (`DA_VR_VR90F_QRB4210_25K`) |
|---|---|
| Silent on UDP 49152–49160 | Same — ICMP port-unreach / timeout, no DTLS |
| UDP **5683** plaintext OCF | **Yes.** `/oic/d` `2.05` (`rt` includes `oic.d.robotcleaner`); `/oic/res` `2.05` (~24 KiB, **187** hrefs vs WD53’s 72) |
| `GET /.well-known/core` → `4.01` | **Same** (`4.01`) |
| `GET /device/0` → `4.03` | **Same** (`4.03`). Other protected `/…/vs/0` also `4.03` on plaintext |
| UDP **5684** live DTLS | **Yes** — ClientHello → HelloVerifyRequest |
| Advertised `coaps` endpoint can move | **Yes** — `/oic/res` advertised a dynamic high port that also answered ClientHello (not a fixed 4915x) |
| AC14K_M leaf → fatal **`unknown_ca`** | **Same.** Server cert role `OU=OCF HA Device` / OCF HA Device SubCA v1 / OCF Root CA. Handshake gets CertificateRequest then the alert. RSA-vs-ECDSA was not re-tried; one AC14K_M chain that already works on this LAN’s 4915x appliances is enough to classify the trust store |
| Cipher / verify | Did not disable verification. Did not brute-force ciphers |
| `/oic/sec/doxm` `oxms` includes `2` and `0xFF02` (65282) | **Same:** `oxms = [2, 65282]`, `oxmsel = **2**`, `sct = 1` |
| `/oic/sec/pstat` owned vs RFOTM window | **`isop = true`, `cm = 0`, `om = 4`, `sm = 4`** — already operational. This is **not** issue #20’s `owned:false` / `isop:false` window |
| OTM / `/oic/sec/*` writes | **Not attempted.** Device is already owned; I am not going to open a manufacturer-OTM window or replace the owner |

So: detection should include 5683/5684 (and advertised `coaps` ports), but **runtime control is still blocked on an authorized OCF-PKI client credential**, same remaining gap as #16. I will not run the WD53 same-account / OwnerPSK setup path on this unit.

The previous comment has the public href samples (power/mode/map/station/energy). Happy to run any other *read-only* #16 probe if useful.
